show_id,title,description
81189912,Drive,"A notorious thief allies with a street racer for a grand heist involving an elaborate game of deceit with authorities, who have their own dirty secrets."
80215046,Elliot the Littlest Reindeer,"When Blitzen suddenly retires, a miniature horse determined to join Santa's reindeer team faces fierce competition in the North Pole tryouts."
60036838,Enter the Dragon,"Recruited by a British agent, Shaolin master Lee infiltrates a remote island and a brutal martial arts tournament to spy on a sinister crime lord."
81179693,Euphoria,"An entrepreneur prone to partying and his estranged brother, a teacher resigned to a humdrum life, begin to bond under fragile circumstances."
485218,Executive Decision,"When terrorists hijack a 747 and turn it into a nerve gas bomb aimed at Washington, D.C., commandos use an experimental plane to try to stop them."
1192866,Fallen,A tough homicide cop faces his most dangerous assignment when he must stop a murderous evil spirit who can move from one host to the next.
11819434,Fear and Loathing in Las Vegas,A sportswriter and his Samoan lawyer embark on a hallucinogenic three-day romp from Los Angeles to Las Vegas in this counterculture cult favorite.
516788,Forbidden Planet,"A pulp-fiction sci-fi classic, Forbidden Planet stars Leslie Nielsen as a heroic starship captain who finds the paradise planet Altair-IV."
70048968,Getting Played,"Tired of dealing with boyfriends who wrong them, gal pals Lauren, Emily and Andrea decide to turn the tables and become the players themselves."
542137,Gigi,Gigi's an avant-garde French waif being groomed as the fille de joie of affluent and handsome Gaston. Soon Gigi metamorphoses into a stunning beauty.
60021796,Gosford Park,"In this witty whodunit, wealthy guests and their servants gather for a weekend stay at the home of Sir William McCordle, who is soon found murdered."
60031247,Gothika,"After a car crash, a criminal psychiatrist awakens to find that she's a patient in the same mental institution that currently employs her."
60000577,Grease,John Travolta and Olivia Newton-John star in this hit musical comedy about a greaser and the good girl he falls for – much to his friends' chagrin.
81083786,Holly Star,"Home for the holidays, a broke puppeteer knows there’s treasure buried somewhere under her town. To find it, all she has to do is die – almost."
80153894,How to Be a Latin Lover,"When an aging Lothario gets the boot from his sugar mama, he must pull out all the stops to find a new female sponsor."
1179333,How to Be a Player,"Dray lives life one woman at a time and is the envy of all his friends, until his sister decides to show him the error of his philandering ways."
70118779,Invictus,"After the end of apartheid, newly elected President Nelson Mandela uses the 1995 World Cup rugby matches to unite his people in South Africa."
653673,Jimi Hendrix,"Jimi Hendrix's family, friends, and fellow musicians discuss his life and influence. Hendrix also appears in classic performance footage."
70020947,King's Ransom,"A wealthy, despicable businessman comes to the realization that he may lose half his fortune to the obnoxious wife he's trying to divorce. So, he decides to arrange his own kidnapping in order to wipe himself out and claim poverty."
70117305,Legion,A motley crew of apocalypse survivors living at an abandoned truck stop never suspects that the pregnant woman among them is carrying the Messiah.
701346,Like Water for Chocolate,"When Pedro marries her sister, Tita throws herself into her cooking – and discovers she can transfer her emotions through the food she prepares."
709163,Logan's Run,"In the 23rd century, inhabitants of a domed city exist in a world filled with life's pleasures – but no one is allowed to live past the age of 30."
709380,Lolita,"In this black comedy, an English professor marries his landlady to get closer to his forbidden obsession: her teenage daughter."
1150871,Love Jones,"In this urban romantic comedy set in Chicago, the ups and downs of courtship play out between a young black poet and a pretty shutterbug."
70082264,Mad Money,A woman joins the janitorial staff of the Federal Reserve Bank and conspires with two co-workers to pilfer old money that's scheduled to be destroyed.
1179583,Money Talks,"TV news reporter James Russell helps put small-time criminal Franklin Hatchett in jail, but turns to protecting Hatchett when he escapes from prison."
70044595,Monster House,Three friends uncover the truth about a scary abandoned house in their neighborhood that has a personality of its own and seems to be eating people.
60011729,Mutiny on the Bounty,"Marlon Brando gives a nuanced performance as the aristocratic Lt. Fletcher Christian, an officer aboard the HMS Bounty who leads a mutiny against the ship's tyrannical Capt. Bligh."
70044883,Nacho Libre,"When Ignacio learns of an orphanage's financial woes, he pitches in to help – by disguising himself and joining the professional wrestling circuit."
60021590,Ocean's Eleven,"Frank Sinatra leads an all-star cast as Danny Ocean, who decides to knock over a few casinos on the Las Vegas Strip with his buddies."
60023638,Paid in Full,This fictionalized account of three real-life notorious Harlem drug dealers is told in flashbacks as they plunge into the world of hustling.
70031792,Rebel Without a Cause,"When Jim Stark arrives in a new town with his troubled past firmly in tow, he quickly falls for the girl next door and befriends the vulnerable Plato."
70100383,Revolutionary Road,"April and Frank's marriage unravels when a plan to change their ""perfect"" lives becomes their last hope to escape lives engulfed in emptiness."
60002403,Rosemary's Baby,"A woman is thrilled to find out she's pregnant. But as her belly grows, the more certain she becomes that her unborn child is in serious danger."
17236920,Rounders,"A law student befriends and ""befoes"" a fellow gambling addict and a club owner, and tensions run high when they must come up with $15k in just 5 days."
923574,Rumble in the Bronx,"During a visit to the Bronx to help out at his uncle's store, a cheerful martial arts expert springs into action when a gang terrorizes the shop."
81152930,Santa Girl,"Fleeing the family business and an arranged marriage, Santa’s daughter chooses a magical adventure of her own: College."
973861,Sling Blade,"A man returns home after being released from a psychiatric hospital, where he'd been confined since age 12 for murdering his mother and her lover."
70058796,Sparkle,"In 1950s Harlem, three singing sisters hit the big time and end up losing one another in this musical melodrama inspired by the Supremes."
70047101,Spider-Man 3,The seemingly invincible Spider-Man goes up against an all-new crop of villains in the third installment of the blockbuster adventure series.
81189396,Spitfire: The Plane that Saved the World,"In this epic documentary, last-surviving veterans trace the history of a legendary fighter aircraft that dominated the air during the Battle of Britain."
70093991,Step Brothers,"Brennan and Dale might be grown men, but that doesn't stop a childish sibling rivalry from erupting after Brennan's mom marries Dale's dad."
60033247,Superfly,"To get away from the thug life, cocaine dealer Youngblood Priest puts together one last deal that will net him enough money to start over."
70060000,The Brave One,New York City radio host Erica Bain decides to take the law into her own hands after losing her fiancé in a brutal Central Park attack.
70295067,The Christmas Candle,A progressive new minister's arrival in a small village threatens to end an age-old tradition that brings a yuletide miracle to one of the residents.
70031779,The Cincinnati Kid,"In Depression-era New Orleans, cocksure stud poker player Eric Stoner – the titular Cincinnati Kid – challenges longtime champ Lancey ""The Man"" Howard to a showdown at the table, where a war of wills – and nerve – ensues."
1178866,The Game,"Nicholas receives an unusual birthday present from his brother, Conrad – a gift certificate to play a unique kind of game formulated by ""CRS."""
60033312,The Great Raid,"In World War II, a battalion goes on a daring rescue mission to liberate the Americans and Filipinos who've been captured by the Japanese."
684847,The Last Boy Scout,Private eye Joe Hallenbeck is forced to team up with a disgraced quarterback to uncover a conspiracy by a politician and a football team owner.
81150305,The Man Without Gravity,A gravity-defying boy raised in seclusion matures into an extraordinary man – and an international celebrity – who longs for human connection.
20557937,The Matrix,"A computer hacker learns that what most people perceive as reality is actually a simulation created by machines, and joins a rebellion to break free."
60027695,The Matrix Reloaded,"The crew must protect Zion, the last outpost still under human control, after it is pinpointed by the machines responsible for the Matrix."
60031303,The Matrix Revolutions,The final installment in the Matrix trilogy finds an unconscious Neo trapped in a subway station in a zone between the Matrix and the machine world.
848915,The Pelican Brief,"When law student Darby Shaw theorizes about the assassinations of two Supreme Court justices, she is put in danger and turns to a reporter for help."
60022980,The Tuxedo,"After a government spy is hospitalized, New York City cab driver Jimmy unwillingly takes over the spy's role – with the aid of a computerized tuxedo."
60003961,"Thelonious Monk: Straight, No Chaser",The spotlight shines on iconic jazz pianist and composer Thelonious Monk in this 1988 documentary featuring vintage performance clips and interviews.
70060005,Vantage Point,"Moments after he arrives in Spain for an antiterrorism summit, U.S. President Ashton is shot."
70084791,Wild Child,"When a spoiled girl pushes her father too far with her spending and outlandish behavior, he ships the Malibu princess off to a strict boarding school."
70123542,Zombieland,"Looking to survive in a world taken over by zombies, a dorky college student teams with an urban roughneck and a pair of grifter sisters."
70107499,A Wednesday,"After receiving an anonymous tip about a bomb, a police commissioner must negotiate with the terrorist, who demands the release of four militants."
70123117,Aagey Se Right,"A cop full of self-doubt loses his gun five days before he's due to leave the force, and becomes an unexpected hero as he tries to retrieve it."
70100644,Aamir,"In this high-tension thriller, an anonymous caller on a cell phone threatens to harm a man's family if he doesn't carry out every order."
80057750,ABCD 2,"After being accused of cheating on a reality TV show, a dance troupe seeks to redeem itself by winning the World Hip-Hop Dance Championship."
70229045,ABCD: Any Body Can Dance,"Thrown out of the elite dance studio he founded, Vishnu's spirits rebound when he sees young street dancers prepping for an annual contest."
70139073,Arjun: The Warrior Prince,This animated retelling of the classic Indian tale of Prince Arjun – part of the Sanskrit epic Mahabharata – begins during the prince's youth.
81024731,Asees,"When a dispute breaks out between five siblings over their mother’s property, one devoted son will go to any lengths to protect her land."
70219525,Barfi!,"Years after rejecting Barfii, a hearing and speech impaired young man, for a more ""appropriate"" suitor, Shruti finds herself falling for him."
16914787,BASEketball,"When two slackers' made-up sport, BASEketball, becomes a national craze, they hope to cash in on the basketball/baseball hybrid's popularity."
80039595,Chaar Sahibzaade,"With a horde of enemy invaders bearing down, four sons of an illustrious Sikh guru lead a tiny but valiant army into a desperate fight for freedom."
70123120,Chance Pe Dance,"Having risen from humble beginnings, an ambitious young man sets his sights on winning a major dance competition that could catapult him to fame."
80224055,Christmas With A View,"Still reeling from a business failure, the restaurant manager of a ski resort finds her world jolted by a new chef, who has his own hidden past."
70052249,Chup Chup Ke,"Mistaking a broke, small-time hustler for a millionaire, two bumbling fishermen hatch a scheme to use him to help pay off their debts."
70084775,Dhan Dhana Dhan Goal,"In a last-ditch effort, the jaded coach of the Southall United Football Club assembles a ragtag team and helps lead the team to a comeback season."
70114588,Dhoondte Reh Jaoge,"An accountant and a producer hatch a scheme to finance a movie, while making every effort to ensure that it flops so they may pocket the difference."
70185139,Do Dooni Chaar,"A struggling math teacher holds down a second job to keep his family afloat. But when he receives a wedding invitation, he's determined to attend."
80232501,Edge of Fear,"During a wilderness getaway, a gang of sociopathic criminals kidnap a woman and assault her husband, who must summon all his strength to save her."
80210147,"Edmilson Filho: Notas, Comedy about Relationships","Brazilian comedian Edmilson Filho walks his audience through the stages of a modern relationship, playing up the differences between men and women."
80224606,Filmworker,Leon Vitali had a thriving acting career most others would envy. Then he gave it all up to devote himself completely to the vision of Stanley Kubrick.
80058851,Gaddar: the Traitor,An Indian man who has become a major business mogul in Canada must return to his homeland where he's reviled due to being wrongly branded a traitor.
70219528,Ghanchakkar,"Former con artist Sanju surrounds himself with the finer things, a blissful life troubled by only one thing: his wife, who wants even more."
70241088,Grandmaster,"Anticipating the next move in a serial killer's grisly game, a police chief realizes that his daughter and estranged wife are the next likely victims."
70068799,Hattrick,Stories of personal victories coincide with Team India's battle for the Cricket World Cup in this engaging ensemble drama.
70229044,Heroine,One woman experiences the dramatic highs and lows of fame in this voyeuristic glimpse past the glitz and glamour of a Bollywood superstar's life.
70254349,Himmatwala,A young man returns to his native village on a mission of vengeance after his father commits suicide in the wake of false accusations.
70254342,Husbands in Goa,"Three professional friends, all husbands living with domineering wives, take a well-deserved vacation in the resort city of Goa."
80084838,Jatts in Golmaal,"Without fully realizing the consequences, a boy who wants to relocate from India to Canada sells his heart to a gangster in need of a transplant."
70254346,Kai Po Che!,This Bollywood drama tells the story of three best friends who dream of starting a cricket training academy in Ahmedabad for very different reasons.
70229040,Kalakalappu,"Cheenu dreams of resurrecting the restaurant he has inherited to its former glory, but his brother, a compulsive gambler, loses the place to a cop."
70056663,Katt Williams: The Pimp Chronicles: Pt. 1,"In this 2006 show, comic Katt Williams uses his edgy style and personal experiences to paint a sassy, hilarious portrait of life in black America."
80067906,Katti Batti,"After falling in love during college, architect Maddy and free spirit Payal have five wonderful years together, until a mystery suddenly divides them."
70071832,Life in a ... Metro,A group of Mumbai up-and-comers search for love and struggle for success in this ensemble drama that centers on an eager young call-center executive.
70273401,Marc Maron: Thinky Pain,"Alternative comic Marc Maron is back on stage in New York to talk Chinese food, drug abuse, sex in hotel rooms and life with his girlfriend."
80097390,Morris from America,"When his father moves from the U.S. to Heidelberg, Germany, an African American teenager struggles to find his place and pursue his hip-hop dreams."
70106268,Mumbai Meri Jaan,"A moving portrayal of the 2006 train bombings in Mumbai, this Indian drama follows the interconnected stories of several strangers."
80039594,Mundeyan Ton Bachke Rahin,"When they both fall for the same girl, best pals and shameless womanizers Prince and Jassi go head-to-head to compete for her love."
70139076,No One Killed Jessica,This thriller tells the true story of model Jessica Lall – who was shot dead in a restaurant – and the campaign to bring her killer to justice.
70109758,Oye Lucky! Lucky Oye!,"Starting as a petty thief, a man rises to become one of the city's biggest operators and carves out the kind of lifestyle he'd once only dreamed of."
70123126,Paan Singh Tomar,Paan Singh Tomar goes from celebrated runner to star brigand and rebel when life after sports fails to unfold as planned.
70303431,Raja Natwarlal,A small-time con man assembles a team to help him avenge the death of his partner-in-crime at the hands of a powerful gangster.
70254351,Satyagraha,"In this Bollywood drama, a corporate go-getter sees his priorities shift when personal tragedy brings him face-to-face with political corruption."
70275076,Settai,"Asked to deliver a package for a friend, Madhu gets her fiancé, Jayaganthan, to take care of it, and he then passes the task to one of his roommates."
80189997,Sigaram Thodu,A policeman's son overcomes his reluctance to join the force following a brutal attack on his father and ends up in the middle of a robbery case.
81015100,Sommore: The Reign Continues,"Self-proclaimed ""Queen of Comedy"" Sommore storms the stage to deliver a riotous stand-up performance in Charlotte, North Carolina."
80076581,Stink!,"After noting a strange odor in his child’s pajamas, a single dad’s search for the source uncovers potentially toxic secrets of the chemical industry."
81025404,The Tigers of Scotland,"This documentary highlights the endangered existence of the Scottish wildcats, and the conservation efforts required to prevent their extinction."
80182949,The Untold Tales of Armistead Maupin,"This documentary traces the life of ""Tales of the City"" author Armistead Maupin, from his conservative roots to his rise as an LGBTQ champion."
70060017,The Water Horse: Legend of the Deep,A boy watches an egg he found hatch into something incredible. But how long can he keep such a big secret from his mom – and the Scottish government?
70266675,Transcendence,Two computer scientists work to achieve technological singularity to create a world where computers can transcend the abilities of the human brain.
80155792,Vaya,"Three youths from rural South Africa set out for Johannesburg, where they're thrust into the seedy underbelly of the city and must fight to survive."
70108590,Welcome to Sajjanpur,"An educated man assists the illiterate residents of his village with written correspondence, sometimes manipulating the letters to suit his interests."
70185141,Zokkomon,"When his cruel uncle abandons him, a young orphan learns to access the untapped superpowers that have been waiting within him all along."
80201826,6-5=2,"Six friends decide to undertake a grueling mountain trek, only to find that the difficulties in store for them are not merely physical."
80158388,Bandie,"Heirless Maharaj Brajbhan leaves his throne to his cousin Vikram, but when Brajbhan's wife, Badi Rani, finally conceives, Vikram plots to destroy her."
80203778,Beiimaan Love,"After having her heart broken by a man who seduced her at a party, a young, ambitious woman concocts a scheme to get revenge."
80201820,Coffee with D,Low TV ratings drive a well-known journalist to concoct a plan to interview a notorious underworld figure who is also a suspected terrorist.
80103312,Getaway Plan,Professional burglar and blowtorch expert Víctor is recruited by the Russian mafia to break into a vault as part of an elaborate bank heist.
80202605,Hajwala: The Missing Engine,A competitive streetcar racer's obsession with winning drive him to develop a vehicle with an innovative engine that's never been used before.
80203791,Kacche Dhaagey,"While visiting India for her cousin's wedding, a Canadian girl develops strong feelings for a boy from a lower caste."
80079229,Kis Kisko Pyaar Karoon,"A man's decision to marry three women, to keep them from committing suicide, complicates his relationship with his girlfriend."
80080145,Moor,"A railway stationmaster tries to cope with his wife's death, his estrangement from his son and the corrupt world in which he lives."
80157797,Pettersson and Findus 2,"Christmas is just around the corner, but Pettersson and Findus are worried the snowy weather (and lack of a tree) may keep them from celebrating."
80032364,Punjab 1984,"During a time of political turmoil, a mother goes on a journey in search of her missing son, who has been misjudged and labeled a terrorist."
80203786,Rivaaz,"In a village where girls are auctioned off rather than married, a man falls in love with a girl who is about to face the bidders."
80032097,Romeo Ranjha,"Two common boys travel from India to Thailand to find success and money, enjoying their friendship and finding ways to cheat the cheats."
80156684,Savage Dog,A former professional boxer serving time in a brutal labor camp must fight incredible odds to gain his freedom and avenge an act of violence.
80174727,The Bittersweet,"As a killer stalks the streets, a troubled young courier suspects that a doctor may be the long-lost sister he hasn't seen since childhood."
80201827,Trip to Bhangarh: Asia's Most Haunted Place,"To amuse themselves, six college friends decide to pay a visit to a fortress believed by some to be the most haunted place in Asia."
80179288,Undercover Grandpa,"Jake's date with his dream girl takes a turn when she disappears, and Jake's grandpa – a former intelligence officer – sets out to find her."
80203780,Waarrior Savitri,"In a modern adaptation of a mythological tale, a devoted wife is willing to do whatever it takes to rescue her husband from the clutches of death."
80216215,Warehoused,A soon-to-be-retiring Mr. Lino teaches 20-something Nin the strict rules of his new warehouse job in this dramedy about the absurdities of work life.
80211371,Yaara O Dildaara,The patriarch of a wealthy family with one industrious son and one who's a playboy arranges for the marriage of one to the woman the other loves.
80144358,A Grand Night In: The Story of Aardman,"Aardman Animations icons Wallace & Gromit, Morph and more join fans and collaborators for a retrospective celebrating the studio's 40th anniversary."
80097360,Norman Lear: Just Another Version of You,"This documentary turns the spotlight on the man behind the iconic ""All in the Family,"" with comments from friends, family and famous collaborators."
80093212,Spanish Affair 2,Spanish provincialism is put into the spotlight as a man from the Basque Country embarks on a mission to keep his daughter from marrying a Catalan.
60000545,The Interview,"When a man who's seemingly lost everything is grabbed by police for questioning, it starts a twisted cat-and-mouse game between him and a detective."
80025702,The Last Days of Chez Nous,Successful writer Beth's tepid marriage and home life face a new round of challenges when her footloose younger sister arrives for an extended visit.
80156369,Winter of Our Dreams,"After the death of a long-ago lover, married philanderer Rob tracks down her friend, a drug-addicted prostitute desperate to escape her dead-end life."
1145882,Young Tiger,"Aided only by a tough female police officer, a Hong Kong taxi driver tries to escape from gangsters pursuing incriminating evidence left in his cab."
70288423,A Russell Peters Christmas,"Inspired by the variety shows of the 1970s, ""A Russell Peters Christmas"" is a sweet, silly, sentimental and, most of all, funny Christmas special."
70290568,Aziz Ansari: Buried Alive,"""Parks and Recreation"" star Aziz Ansari takes the stage to share his unfiltered views on adulthood, babies, marriage, love and more in the modern era."
70141644,Mad Ron's Prevues from Hell,"This collection cherry-picks trailers, forgotten scenes and poster art from 47 gory oldies, including Bay of Blood and The Blood Spattered Bride."
81035836,Antar: Son of Shadad,"Learning he is the grandson of a famous knight, a young man hilariously fights a rival gang to win over the most beautiful woman in the tribe."
81044103,Bathtubs Over Broadway,"A comedy writer for David Letterman unearths a hidden world of hilariously bizarre musicals, which turns into a toe-tapping obsession."
81072917,Gatao 2: Rise of the King,"When a zealous gang leader plans to take out a friend-turned-rival for control of his turf, internal tensions complicate the battle to be the boss."
70142542,Insidious,"Hoping to leave their haunted house behind, a suburban family moves to a new place, only to learn the home wasn't haunted... but their eldest son is."
81035855,Lion's Heart,"Kidnapped as a child and raised in the circus, a young lion tamer’s tough side emerges when he gets entangled in an underworld murder mystery."
81035845,Regatta,Inside one of Cairo's most impoverished areas exists a place where criminals control everything and everyone.
81035856,Tattah,A down-on-his-luck man must prove he's not as hapless as he seems when the woman he's on a date with is suddenly kidnapped.
80134780,"Norm Macdonald: Hitler's Dog, Gossip & Trickery","In this new stand-up special, Norm Macdonald delivers sly, deadpan observations from an older – and perhaps even wiser – point of view."
80221308,Desolation,"Along with her son and best friend, a grieving widow hikes into the woods to scatter her late husband's ashes, only to discover they're being stalked."
