show_id,title,description
81145628,Norm of the North: King Sized Adventure,"Before planning an awesome wedding for his grandfather, a polar bear king must take back a stolen artifact from an evil archaeologist first."
80125979,#realityhigh,"When nerdy high schooler Dani finally attracts the interest of her longtime crush, she lands in the cross hairs of his ex, a social media celebrity."
70304989,Automata,"In a dystopian future, an insurance adjuster for a tech company investigates a robot killed for violating protocol and discovers a global conspiracy."
80164077,Fabrizio Copano: Solo pienso en mi,"Fabrizio Copano takes audience participation to the next level in this stand-up set while reflecting on sperm banks, family WhatsApp groups and more."
70304990,Good People,A struggling couple can't believe their luck when they find a stash of money in the apartment of a neighbor who was recently murdered.
70299204,Kidnapping Mr. Heineken,"When beer magnate Alfred ""Freddy"" Heineken is kidnapped in 1983, his abductors make the largest ransom demand in history."
80057969,Love,A man in an unsatisfying marriage recalls the details of an intense past relationship with an ex-girlfriend when he gets word that she may be missing.
80060297,Manhattan Romance,A filmmaker working on a documentary about love in modern Manhattan becomes personally entangled in the romantic lives of his subjects.
80046728,Moonwalkers,"A brain-addled war vet, a failing band manager and a Stanley Kubrick impersonator help the CIA construct an epic scam by faking the 1969 moon landing."
70304988,Stonehearst Asylum,"In 1899, a young doctor arrives at an asylum for an apprenticeship and becomes suspicious of his mentor's methods while falling for a female patient."
80057700,The Runner,A New Orleans politician finds his idealistic plans for rebuilding after a toxic oil spill unraveling thanks to a sex scandal.
80045922,6 Years,"As a volatile young couple who have been together for six years approach college graduation, unexpected career opportunities threaten their future."
70241607,Laddaland,"When a family moves into an upscale housing development, they encounter a series of paranormal events that drive them to the edge of insanity."
80988892,Next Gen,"When lonely Mai forms an unlikely bond with a top-secret robot, they embark on an intense, action-packed adventure to foil the plot of a vicious villain."
80239639,Sierra Burgess Is A Loser,A wrong-number text sparks a virtual romance between a smart but unpopular teen and a sweet jock who thinks he's talking to a gorgeous cheerleader.
80159586,The Most Assassinated Woman in the World,"In 1930s Paris, an actress famous for her gory death scenes at the Grand Guignol Theater contends with a mysterious stalker and ghosts from her past."
80152447,Cézanne et moi,"This historical drama explores the long and often volatile friendship of painter Paul Cézanne and writer Émile Zola, who first met as schoolboys."
81154455,Article 15,The grim realities of caste discrimination come to light as an entitled but upright city cop ventures into India’s heartland to investigate a murder.
81052275,Ee Nagaraniki Emaindi,"In Goa and in desperate need of cash, four childhood friends get another shot at making their long-abandoned dreams of becoming filmmakers come true."
80058026,Hell and Back,"When best friends break a blood oath, one of them is cast away to hell, and the other two must save him from the misfits of the underworld."
70303496,PK,Aamir Khan teams with director Rajkumar Hirani to play a social crusader in a political satire on the state of corruption in India.
80162141,Hard Tide,A drug dealer who's been emulating his father's successful criminal career is forced to go on the run with a young girl in this fact-based thriller.
80095641,Elstree 1976,"Then and now footage of bit players who appeared in ""Star Wars"" tells the story of how the film and its legions of fans changed their lives forever."
80159880,ATM,"When a broken ATM dishes out a fortune, a couple who works at the bank vies to see who can recover the most cash – and the loser must find a new job."
81016044,Bangkok Traffic (Love) Story,"After an encounter with an engineer working the night shift for the city train, a 30-year-old woman struggles against all odds to pursue true love."
80158838,I Fine... Thank You... Love You,"Desperate to go to the U.S. to win back his girlfriend, Yim hires a tutor to teach him English. But things don't go according to plan."
81016045,One Day,"When his colleague (and crush) temporarily loses her memory, an overlooked geek seizes the chance to make an impression before she remembers again."
70142798,Phobia 2,"From disfiguring punishments to festering souls, Thai horror masters present five supernatural tales of karma in this sequel to the 4bia anthology."
70062814,Shutter,"After killing a young girl in a hit-and-run accident, a couple is haunted by more than just the memory of their deadly choice."
80158839,Suckseed,"When his boyhood crush Ern returns, Ped forms a band with his friend to impress her. Romantic rivalries bloom after the talented Ern joins the group."
80147760,Carrie Pilby,"A socially awkward 19-year-old genius makes big plans to step out of her shell and make a friend, get a job and – maybe – even go on a date."
80177405,Marc Maron: Too Real,"Battle-scarred stand-up comedian Marc Maron unleashes a storm of ideas about meditation, mortality, documentary films and our weird modern world."
81160036,Saawan,"Outcast from society and left to die in the wilderness, a young boy with polio embarks on a journey to connect with his mother. Based on a true story."
81173255,The Heretics,A withdrawn young woman hunted by a malicious cult is abducted by a brooding stranger and undergoes a bizarre transformation.
81078908,The World We Make,"A teenage equestrian and a local football player for each other, but simmering racism in their small town puts their relationship to the test."
81155784,Watchman,"Rushing to pay off a loan shark, a young man breaks into a bungalow to steal the cash, unprepared for the dog standing guard – or the trouble inside."
80201906,Black Panther,"T'Challa, the superpowered new leader of the hidden, highly advanced African nation of Wakanda, strives to protect his home from enemies old and new."
80052612,Man Up,"A single woman seizes an opportunity when, while standing under a train station clock, she meets a stranger who mistakes her for his blind date."
81054495,Mo Gilligan: Momentum,"Comedian Mo Gilligan blends smooth moves and sharp humor as he riffs on humble beginnings, family dynamics and the complex art of dancing in the club."
70212504,Big Miracle,"After a reporter writes about whales trapped in the Arctic Circle, the U.S. and U.S.S.R. team up to rescue them in this tale inspired by true events."
80187061,The Mayor,"With the presidency in mind, the incumbent mayor of Seoul runs for an unprecedented third term – and will stop at nothing to keep his secrets hidden."
80198585,The Debt Collector,"A broke martial arts instructor takes a side gig with a mobster, who pairs him with a veteran thug for a weekend of fisticuffs-fueled debt collection."
70233894,Act of Vengeance,"Two Turkish agents are sent to New York City on a mission to capture a notorious terrorist known only as ""Dejjal"" (Arabic for Antichrist)."
81011955,Paradise Lost,"A cop moonlights as the bodyguard for a young drag queen at a nightclub, and grows closer to the family of misfit singers that perform there."
80128722,Gerald's Game,"When her husband's sex game goes wrong, Jessie – handcuffed to a bed in a remote lake house – faces warped visions, dark secrets and a dire choice."
80104068,Our Souls at Night,"After widowed neighbors Addie and Louis begin sleeping in bed together platonically to alleviate their loneliness, a real romance begins to blossom."
80019931,"Monster High: Boo York, Boo York",Cleo is invited to a gala in the big city celebrating a magical comet and brings her best friends along. But the sinister Nefera has other plans.
80200087,Domino,"A Copenhagen police officer hunts for the man who attacked his partner, only to stumble into a high-stakes game of espionage."
81002850,5CM,"Five friends embark on a mission to climb the highest peak in Java, overcoming obstacles on the way and discovering the true meaning of friendship."
81004470,Animal World,"An unlucky, debt-ridden teen resorts to his math skills when he's forced into a deadly tournament of rock-paper-scissors run by a diabolical host."
80157072,Hold the Dark,"In the grim Alaskan winter, a naturalist hunts for wolves blamed for killing a local boy, but he soon finds himself swept into a chilling mystery."
81002864,Single,"Unemployed and immature, a somewhat pathetic bachelor sets his sights on finding a date for the wedding of his younger, more successful brother."
81016750,The 3rd Eye,"When her little sister claims she sees the dead, Alia consults a psychic, who opens her own eyes to the vengeful ghosts haunting their childhood home."
81002866,The Sinking Of Van Der Wijck,"When a young man leaves home to fulfill the wishes of his late father, he meets and falls in love with a woman from a very different background."
81132443,Deliha 2,"While chasing her dream of becoming a chef, Zeliha cooks up trouble in the kitchen with her wild, kooky and unsuspecting ways."
80231903,In the Shadow of the Moon,A Philadelphia detective slowly unravels as he nurses a lifelong obsession with an enigmatic female serial killer whose crimes defy explanation.
81012295,Weeds on Fire,"In 1980s Hong Kong, a school principal forms a baseball team with an eclectic crew of local students who soon fight their way to the top of the league."
80060037,Much Loved,Four friends who make their living as prostitutes in Morocco deal with both the dangers and stigma that come with their profession.
60003155,Joseph: King of Dreams,"With his gift of dream interpretation and his brilliantly colored coat, Joseph inspires jealousy in his brothers in this animated Bible story."
81177238,Malaal,"Class divides become thorns in the budding romance between the crony of a nativist Mumbai politician and the new, North Indian resident of his chawl."
70270775,The Grandmaster,"As the Japanese invasion looms, Chinese kung fu master Ip Man's world changes when rival master Gong Er and her father arrive in his village."
80215923,The Hurricane Heist,A deadly hurricane with mile-high waves provides the perfect cover for stealing $600 million from a U.S. Treasury outpost in Mississippi.
80151483,Def Comedy Jam 25,"In this special live event, giants of stand-up come together to commemorate the 25th anniversary of Russell Simmons's groundbreaking ""Def Comedy Jam."""
80173625,Restless Creature: Wendy Whelan,"After 30 years with the New York City Ballet, celebrated dancer Wendy Whelan redefines herself as an artist in a new stage of life."
81075519,Furie,"When traffickers kidnap her daughter from their village, vengeful Hai Phuong returns to Saigon – and her outlaw roots – to take down the abductors."
80166318,Leap!,"Félicie and Victor, two young friends in 1880s France, escape from an orphanage to pursue their dreams in Paris, the glittering City of Lights."
81186758,Oh! Baby (Malayalam),A surly septuagenarian gets another chance at her 20s after having her photo snapped at a studio that magically takes 50 years off her life.
81186757,Oh! Baby (Tamil),A surly septuagenarian gets another chance at her 20s after having her photo snapped at a studio that magically takes 50 years off her life.
80108976,USS Indianapolis: Men of Courage,"After becoming stranded in the Philippine Sea during World War II, a tenacious Navy crew faces a dire lack of supplies and a string of shark attacks."
80208155,A Wrinkle in Time,"Years after their father disappears, Meg and her younger brother Charles Wallace cross galaxies on a quest to save him from the heart of darkness."
80162144,White Island,"Returning to Ibiza after several years walking the straight and narrow in London, Connor falls back in with a criminal crowd. It's like he never left."
81053953,Inside Man: Most Wanted,A hotshot NYPD negotiator butts heads with the FBI and meets his match in a meticulous criminal mastermind as she attempts to rob the Federal Reserve.
81074113,Jeff Dunham: Beside Himself,"Jeff Dunham takes the stage in Dallas with his old pals Peanut, Walter, José Jalapeño, Bubba J and Achmed to poke fun at himself and American culture."
80992496,China Salesman,A Chinese engineer travels to a war-torn African country to rebuild its telecommunications but instead finds massive corruption and explosive danger.
70304191,Swearnet: The Movie,"After losing a TV network deal, the Trailer Park Boys launch their own Internet series, but they soon confront personal and creative differences."
80103311,The Bar,Strangers holed up in a Madrid bar after witnessing a murder begin to turn on each other as panic sets in and the body count rises.
81176200,Manmadhudu 2,"Under pressure to marry, a perennial bachelor hires a much younger woman to act as his fiancée, but her bond with his family throws his plan for a loop."
80208906,Under the Eiffel Tower,An American man in the midst of a mid-life crisis travels to the French countryside to find a new lease on life.
80106966,Iliza Shlesinger: Confirmed Kills,"The stand-up sensation tackles TV's ""Shark Tank,"" what it means to be a woman and how to deal with the lawless party goblin that lives in us all."
81080769,Do Paise Ki Dhoop Chaar Aane Ki Baarish,"When a sex worker hires a gay songwriter to care for her disabled son, the ensuing bonds that form offer a complex portrayal of love and family."
70267838,20 Feet From Stardom,"Winner of the 2014 Academy Award for Best Documentary Feature, this film takes a look at the world of backup vocalists and the legends they support."
80211380,In Darkness,"A blind pianist fears for her life after the suspicious death of her neighbor, the daughter of a businessman accused of war crimes."
80196586,Gaga: Five Foot Two,"Follow pop provocateur Lady Gaga as she releases a new album, preps for her Super Bowl halftime show, and confronts physical and emotional struggles."
80099204,The Bad Batch,"Banished to a wasteland of undesirables, a young woman struggles to find her feet among a drug-soaked desert society and an enclave of cannibals."
80059432,SMOSH: The Movie,"To keep his teen crush from spotting him in an embarrassing YouTube video, Anthony and his friend Ian must enter the virtual world and alter the clip."
81172721,King of Boys,"When a powerful businesswoman’s political ambitions are threatened by her underworld connections, the ensuing power struggle could cost her everything."
81172727,Merry Men: The Real Yoruba Demons,"Four of the richest bachelors in Abuja, Nigeria enjoy a life of fast cars, palatial homes and female attention while concealing their true activities."
70153543,Sarah's Key,"Paris, 1942: To protect her brother from the police arresting Jewish families, a young girl hides him away, promising to come back for him."
81172728,The Wedding Party 2: Destination Dubai,"In this sequel to the 2016 hit ""The Wedding Party,"" a couple's date night ends in an accidental proposal, sparking a series of chaotic family events."
80102952,Quincy,"This documentary profiles music and culture icon Quincy Jones, offering unprecedented access to his private life and stories from his unparalleled career."
80243600,Between Two Ferns: The Movie,"Armed with awkward questions and zero self-awareness, Zach Galifianakis hits the road to find famous interview subjects for his no-budget talk show."
81122669,Daddy Issues,"Maya finally hooks up with her online dream girl, only to discover she’s deeply involved with an older sugar daddy – a man Maya knows all too well."
81000389,The Hockey Girls,"The passionate members of a girls' roller hockey team chase down victories in the rink while striving to make time for school, family and romance."
81132439,Travel Mates 2,"When struggling singer Onur decides to return to his old job, incurable klutz _eref organizes a surprise tour full of pitfalls and mishaps."
80150502,Mad World,"A stockbroker struggling with bipolar disorder goes to live with his estranged father in a cramped flat, where old resentments bubble to the surface."
80119815,The First Line,Two determined Athenian attorneys spearhead a lawsuit against the British Museum for the return of the Parthenon Marbles to Greece.
80203776,Bitcoin Heist,"A unconventional, efficient Interpol special agent goes rogue and assembles a team of thieves to catch a shadowy hacker called ""The Ghost."""
80143797,I Am Not Madame Bovary,"To qualify for an apartment reserved for singles, a married couple stages a divorce. But when her husband unexpectedly remarries, Li seeks justice."
80161931,Vincent N Roxxy,"In rural Louisiana, a terse loner forges a redemptive bond with a woman he saved from a killer, but a violent past soon catches up with both of them."
80017275,Miss Julie,"On a summer night in 1890 Ireland, the unsettled daughter of aristocrats coaxes her father's valet to seduce her, though he's engaged to their cook."
81107545,Kabir Singh,"An exalted but short-fused surgeon plunges into a spiral of drugs, alcohol and rage after his intense relationship with his girlfriend turbulently ends."
70118953,Océans,This documentary examines the vital role water plays in human existence and the cause-and-effect interplay between oceans and the environment.
80190449,The Endless,"As kids, they escaped a UFO death cult. Now, two adult brothers seek answers after an old videotape surfaces and brings them back to where they began."
80163156,Jerry Before Seinfeld,"Jerry Seinfeld returns to the club that gave him his start in the 1970s, mixing iconic jokes with stories from his childhood and early days in comedy."
80149143,Come and Find Me,"When his photographer girlfriend vanishes, an L.A. graphic designer starts his own investigation and uncovers a web of deceit, crime and corruption."
80987075,Class Rank,"When her class rank threatens her college plans, an ambitious teen convinces a nerdy peer to run for the school board to abolish the ranking system."
80192815,Barbie Dolphin Magic,"While visiting Ken and exploring a coral reef, Barbie and her sisters make an amazing discovery and meet a mysterious new friend."
80066798,Keith Richards: Under the Influence,"In a documentary with unparalleled access, discover the people and sounds that inspired rock 'n' roll legend Keith Richards from childhood to today."
81147293,A Haunting at Silver Falls: The Return,"When the ghost of her serial killer aunt seemingly resurfaces, Jordan must return to Silver Falls in hopes of finally putting an end to the torment."
80991316,Avengement,"Betrayed by his loan shark brother, a hardened convict escapes from prison while on furlough to exact revenge against the people who made him a killer."
80190588,Clive Davis: The Soundtrack of Our Lives,This music-driven documentary charts Clive Davis' 50-year career as one of the world's most influential record moguls.
70124316,Five Elements Ninjas,"When five ninjas whose fighting styles are based on natural elements unleash their fury on a rival school, a lone survivor vows deadly revenge."
70229037,Sebastian Maniscalco: What's Wrong with People?,"With his uproarious tirade on modern behavior and decorum, the popular comic tackles the question we've all asked in this hilarious standup special."
80037280,The Witch,"Believing that a witch has cursed their family, pilgrims homesteading on the edge of a primeval New England forest become increasingly paranoid."
80058248,I Am Wrath,"Hell-bent on avenging his wife's murder, Stanley Hill summons an old partner's help in exposing a cover-up by crooked cops and slimy politicians."
70307661,"As Above, So Below",A beautiful tomb raider and her crew hunt for treasure in the catacombs of Paris and find themselves in a hellish underworld.
70117312,Scott Pilgrim vs. the World,"Dreamy delivery girl Ramona captures Scott Pilgrim's heart, but he must vanquish all seven of her evil exes in martial arts battles to win her love."
80092885,ARQ,"Trapped in a lab and stuck in a time loop, a disoriented couple fends off masked raiders while harboring a new energy source that could save humanity."
80108371,Cedric the Entertainer: Live from the Ville,"Donning his signature suit and fedora, the dapper comic offers a unique spin on getting old, the presidential election and ""Honky Tonk Badonkadonk."""
70129452,Louis C.K.: Hilarious,"Emmy-winning comedy writer Louis C.K. brings his caustic wit to Milwaukee, offering up his unique and uncensored take on sex, parenting and more."
81030342,Los Tigres del Norte at Folsom Prison,The beloved norteño band Los Tigres del Norte performs for the inmates of Folsom Prison on the 50th anniversary of Johnny Cash's iconic concert.
70054723,Steal a Pencil for Me,This moving documentary chronicles the unshakeable romance between a couple who met and fell in love while imprisoned in a Nazi concentration camp.
81131761,The Outsider,A frontier sheriff tries to protect his sadistic son from a Chinese railroad worker hellbent on revenge.
81016326,Arisan 2,"A group of friends reunites for a vacation amid nature, where they laugh about their shared history and bond over difficult truths."
80227777,Cardboard Gangsters,"A low-level drug dealer decides to move up the ranks of the illegal narcotics trade in Darndale, Dublin, putting him and his gang on a violent path."
81018233,Eeda,Two young adults with families on opposite ends of the political spectrum fall in love in a Kerala city torn by violence.
81016317,Galih dan Ratna,Sparks fly between the new girl at school and the misfit with a passion for music. Yet the world threatens to put a stop to their innocent love song.
81016337,Gie,Indonesian activist Soe Hok Gie experiences a political awakening during the tumultuous regimes of Suharto and Sukarno. Inspired by true events.
81018234,_Goli Soda 2,"A taxi driver, a gangster and an athlete struggle to better their lives despite obstacles like crooked politicians, evil dons and caste barriers."
81018235,_Maj Rati __Keteki,"A successful writer returns to the town that launched his career, encountering people who spark nostalgic, often painfully illuminating flashbacks."
81018236,_Mayurakshi,"When a middle-aged divorcee returns to Kolkata to visit his ailing father, long-buried memories resurface, bringing new discoveries with them."
81018237,Red Oleanders Raktokarobi,"When a theater group stages a production of a Rabindranath Tagore play, they begin to notice parallels between the story and their own lives."
81018238,Samantaral,"On a family visit, a young man and his girlfriend set out to discover why his eccentric uncle has been mysteriously confined to one room for years."
80067522,First They Killed My Father,A 5-year-old girl embarks on a harrowing quest for survival amid the sudden rise and terrifying reign of the Khmer Rouge in Cambodia.
80192149,Gagarin: First in Space,This biopic of Russian cosmonaut Yuri Gagarin follows his rise from childhood poverty to his selection and training for the 1961 Vostok mission.
80142637,Janaan,"After 11 years in Canada, young Meena returns to her native Pakistan for a family wedding and becomes romantically entangled with an adopted cousin."
80192014,Larceny,An ex-CIA contractor turned thief is forced to head a CIA gambit to infiltrate a black ops Mexican prison and steal $50 million in drug cartel money.
80192015,Rumble,"An ex-MMA champion reduced to fixing fights in Mexico must win one last match to save his girlfriend, who's been kidnapped by the mob."
80202129,The Five,"Twenty years after 5-year-old Jesse disappears near his home, his DNA turns up at the scene of a woman's murder, baffling his family and the police."
80088910,Natural Born Pranksters,"The biggest pranksters on YouTube – VitalyzdTV, Dennis Roady and Roman Atwood – turn Hollywood into ""Prankwood"" with their most over-the-top stunts."
70290909,Sample This,"This doc traces the impact of the Incredible Bongo Band's ""Apache,"" which played a key role in the birth of hip-hop after Kool Herc began sampling it."
80033772,Cowspiracy: The Sustainability Secret,Learn how factory farming is decimating the planet's natural resources – and why this crisis has been largely ignored by major environmental groups.
81093951,Oh! Baby,A surly septuagenarian gets another chance at her 20s after having her photo snapped at a studio that magically takes 50 years off her life.
80238013,The Crystal Calls Making the Dark Crystal: Age of Resistance,"Go behind the scenes with stars, puppeteers and creators as they bring Jim Henson's magical world of Thra back to life in a sweeping fantasy series."
81089941,We Have Always Lived in the Castle,The fragile and secretive world of two sisters and their uncle crumbles when their charming cousin arrives with eyes toward the family fortune.
81000011,Bangkok Hell,"When offered a deal to snitch on fellow prisoners, an inmate faces a tough dilemma: act in his own interest, or help those who may need him."
80217733,Bleach,"When high schooler Ichigo is suddenly given reaper abilities, he really wants to give the powers back. But he'll have to reap some souls first."
80999985,Still,"A haunted hotel, a body in a water tank, a nightclub fire and a prison death comprise four horror tales taken from Thailand's newspaper headlines."
80188120,The Angel,"As his country prepares for war, top Egyptian official Ashraf Marwan makes contact with Israel and wades into a shadowy game of high-stakes espionage."
