show_id,title,description
80187684,Kanavu Variyam,"Despite doubts from fellow villagers who think he’s crazy, an ambitious dropout commits himself to solving a persistent local electricity crisis."
80160726,Marco Luque: Tamo Junto,"Eclectic character comedian Marco Luque plays himself in this stand-up special about relationships, regional differences and his own love of movies."
80104706,Mr. Gaga: A True Story of Love and Dance,World-renowned choreographer Ohad Naharin is profiled in this vivid documentary that mixes rehearsal footage with insights about his influence.
80158770,The Russian Revolution,"Starting in 1881, this film describes how the personal battle between the royal Romanovs and Lenin's Ulyanov family led to the Russian Revolution."
70302844,The Pirate Fairy,"In this spritely tale, Tinker Bell and her friends set out to find free-spirited fairy Zarina after she makes off with some precious Blue Pixie Dust."
80245601,DJ Cinderella,"Fiercely independent and disillusioned with love, a teen DJ is determined to chart her own path, till a pop heartthrob falls for her awesome mix."
80242619,Murder Mystery,"On a long-awaited trip to Europe, a New York City cop and his hairdresser wife scramble to solve a baffling murder aboard a billionaire's yacht."
70267830,Cutie and the Boxer,"A 2014 Oscar nominee for Best Documentary Feature, this film explores the symbiotic relationship of artists Ushio and Noriko Shinohara."
81035841,Flimflam,"Nosy family in tow, a fun-loving bachelor goes on a romantic getaway, but he ends up pretending to be married to a complete stranger to avoid trouble."
81147766,Oprah Presents When They See Us Now,"Oprah Winfrey talks with the exonerated men once known as the Central Park Five, plus the cast and producers who tell their story in ""When They See Us."""
81035889,Savage Raghda,"Desperate to support his son, a single father uses his talent with makeup to dress up as a woman to try out for a part in a commercial."
81088277,The 3rd Eye 2,"Working in an orphanage, Alia meets teen Nadia, who says she hears a strange voice in the walls. When they try to find the source, things go very wrong."
81035874,The Ant's Scream,"Released after being wrongly imprisoned in Iraq, an Egyptian contractor returns home to a country on the brink of revolution."
81035883,The Cell,A special operations officer vows to get revenge against the terrorist who killed his friend in a brutal attack.
81035848,The Right One,"Under pressure to marry, a rich playboy is conflicted between four women who each possess a different quality he desires in his ideal wife."
80176756,Dragonheart: Battle for the Heartfire,"When the king of Brittania dies, the dragon who shares his heart must find a new ruler, but the monarch's grandchildren go to war over the throne."
80168221,"Oh, Hello On Broadway","Two delusional geriatrics reveal curious pasts, share a love of tuna and welcome a surprise guest in this filming of the popular Broadway comedy show."
70261178,Reincarnated,"Vice magazine's Andy Capper follows rapper Snoop Dogg on a pilgrimage to Jamaica, where he rechristens himself Snoop Lion, a reggae artist."
81002929,Jo Koy: Comin' In Hot,"Comedian Jo Koy takes center stage in Hawaii and shares his candid take on cultural curiosities, filter-free fatherhood and more."
80221016,Rolling Thunder Revue: A Bob Dylan Story by Martin Scorsese,"In an alchemic mix of fact and fantasy, Martin Scorsese looks back at Bob Dylan's 1975 Rolling Thunder Revue tour and a country ripe for reinvention."
80222188,My Daddy is in Heaven,"After the sudden loss of her husband, a mother has a crisis of faith and struggles to keep her life together for the sake of her daughter and herself."
80221640,Ralph Breaks the Internet: Wreck-It Ralph 2,"When video-game bad guy Ralph and best friend Vanellope discover a way onto the internet, they set off on a mission to save her broken game."
60001104,Daughters of the Dust,An African American Gullah family leaves their coastal island home in 1902 and risks losing their culture to start a new life on the U.S. mainland.
80132601,Havenhurst,"An alcoholic with a tragic past rents an apartment in a building for those in recovery, but soon learns the truth about residents who get ""evicted."""
80176866,Man to Man,"Disguised as a bodyguard, a special agent must complete his national secret tasks while pandering to the whims of his ill-tempered world star."
80114989,Sword Master,"Haunted by the past, a master swordsman masks his identity to work anonymously as a janitor in a brothel, setting in motion a violent chain of events."
81092768,#Selfie,"Two days before their final exams, three teen girls make a seaside getaway to end their adolescence with a bang."
81092766,#Selfie 69,"After a painful breakup, a trio of party-loving friends makes a bet: who can get married in three days."
70060018,"10,000 B.C.",Fierce mammoth hunter D'Leh sets out on an impossible journey to rescue the woman he loves from a vicious warlord and save the people of his village.
70202141,50/50,An otherwise healthy twentysomething has a comically early midlife crisis when he gets slapped with a cancer diagnosis and a 50-50 chance of survival.
81032375,Bullitt County,"When four college friends reunite for a bachelor party, their hunt for cash said to be hidden in Kentucky's backwoods leads to bloodshed and betrayal."
352989,Carrie,"An outcast teen with telekinetic ability lashes out with her deadly power when the high school ""in crowd"" torments her with a sick joke at the prom."
81062606,III Smoking Barrels,"In three stories set in Northeast India, a child goes on the run, a young adult falls in with the wrong crowd and a desperate man turns to crime."
81092767,Love Is a Story,"Two young artists, a violin player and an actress, fight to achieve their dreams and keep their relationship together during Christmastime."
81092909,"Oh, Ramona!",Awkward 16-year-old Andrei is infatuated with his alluring but aloof schoolmate Ramona – until he meets stunning hotel clerk Anemona while on vacation.
81070008,Prosecuting Evil: The Extraordinary World of Ben Ferencz,"A gripping profile of Ben Ferencz, the last surviving lead prosecutor at the Nuremberg trials whose lifelong desire for justice altered the rule of law."
70098605,Righteous Kill,"Two detectives investigate a rash of vigilante killings linked to an old case, suggesting they might have put an innocent man behind bars."
81077539,Satan & Adam,An aging blues guitarist and a grad student form an unlikely duo while busking on the street corners of 1980s Harlem.
20129240,Small Soldiers,"When the Commando Elite, a group of toy action figures, are released before they've been tested, they attack the children playing with them."
70108017,The Box,A couple must decide whether to push a button that will net them a million dollars but that will also cause the death of a complete stranger.
70011219,The Phantom of the Opera,"In 1870, a disfigured recluse roams beneath a Parisian opera house and takes under his wing a young soprano, with whom a love triangle develops."
80097424,The Space Between Us,"After years of limited contact with Earth, an inquisitive teen who lives on Mars makes an interplanetary trek to discover his own origins."
80203143,Then Came You,A hypochondriac confronts his fear of death when a terminally ill teen girl enlists him to help her complete her bucket list.
81068732,We Are Legends,"Raised in a boxing gym, two orphaned brothers become highly skilled martial artists and must combat threats in the streets and the ring."
60026155,What a Girl Wants,"In search of the father she's never met, the daughter of a bohemian American woman heads to Europe and finds that her dad is an uptight politician."
80994443,B.A. Pass 2,"A young woman eager to avoid an arranged marriage moves to Mumbai, where she learns hard truths about show business, life and love."
80245442,Bad Genius,A top student gets pulled into a cheating racket with increasingly higher risks and even higher rewards. But she may lose much more than she gains.
80190515,Bobbi Jene,This candid profile follows dancer Bobbi Jene Smith as she leaves the company of Israeli choreographer Ohad Naharin to forge her own artistic path.
80048218,He Named Me Malala,"This documentary tells the story of a teenage Pakistani girl shot for her advocacy of women's education, her survival, and her continued efforts."
60033300,Miracle,U.S. hockey coach Herb Brooks unites a motley crew of college athletes and turns them into a force to be reckoned with at the 1980 Winter Olympics.
70011206,National Treasure,"Modern treasure hunters search for a chest of riches rumored to have been stashed away by George Washington, Thomas Jefferson and Benjamin Franklin."
80998558,Natsamrat - Asa Nat Hone Nahi,"A veteran Shakespearean actor steps off the stage and into the painful tragedy of old age, facing ungrateful family and his fleeting legacy."
80168167,Outside In,"After serving time for a crime he didn’t commit, a 38-year-old man forms a complicated, life-altering bond with the woman who advocated for his early release."
80245626,Pedal the World,"Over the course of one memorable and adventure-filled year, Felix Starck documents his 18,000-kilometer bicycle journey across 22 countries."
80196584,Singularity,"Nearly a century after artificial intelligence tried to eradicate people from Earth, two survivors search for a human enclave rumored to still exist."
80157084,Aashik Awara,"Raised by a kindly thief, orphaned Jimmy goes on the run from goons and falls in love with Jyoti, whose father indirectly caused his parents' deaths."
80158580,Amelia: A Tale of Two Sisters,"Eight decades after her disappearance, Amelia Earhart's incredible accomplishments are still celebrated, thanks in large part to her sister Muriel."
80108609,Betting on Zero,"This documentary dives into the complex world of Herbalife, the international nutritional products company accused of being a pyramid scheme."
80144804,Catfight,Two college frenemies whose lives aren't what they hoped meet up decades later and escalate their resentments from verbal jabs to bloody brawls.
80106038,Devil's Bride,"On a small Finnish island in 1666, a teenage girl in love with a married fisherman becomes the center of a tragic witch hunt and power struggle."
60000901,How the Grinch Stole Christmas,The Grinch decides to rob Whoville of Christmas – but a dash of kindness from little Cindy Lou Who and her family may be enough to melt his heart.
80158769,How to Stage a Coup,"Explore how Caesar, Napoleon, Mussolini, Hitler and modern-day dictators consolidated their considerable power through bold and brazen coups."
80158579,Jackie: A Tale of Two Sisters,"Rachael Stirling narrates this multifaceted portrait of former First Lady Jacqueline Kennedy Onassis and her younger sister, Lee Radziwill."
80158920,Lens,"Addicted to webcams and voyeurism, a married man gets more than he bargained for when an online stranger tries to force him to watch a suicide."
80107736,Little Boxes,"After moving from New York City to a small town in Washington state, an interracial couple and their preteen son struggle to adjust to their new life."
80148967,Love.com,"When a fashion blogger falls for a video game vlogger, their romance goes viral. But separating their virtual life from reality gets complicated."
70057994,Maya Memsaab,"A beautiful, wealthy woman’s insatiable appetite for romance leads to tragedy and a police investigation."
80156937,Oh Darling Yeh Hai India,A penniless actor new to Mumbai and a beautiful woman he meets one fateful night try to stop a gangster from replacing India's president with a twin.
80158546,Prince,"To better himself, a spoiled prince temporarily assumes a commoner’s identity. But he soon learns his palace has been gifted to his father’s new wife."
80156936,Qila,"When an abusive landowner is murdered, his twin brother sets out to find the killer but quickly discovers that everyone, it seems, wanted him dead."
80121843,Smoke & Mirrors,"Betrayed by the Spanish government he once served, a former secret agent plots to steal millions of dollars embezzled by a corrupt public official."
80158581,The Mitfords: A Tale of Two Sisters,Jessica and Diana were sisters who were separated by just a few years in age. But their political ideologies couldn't have been any farther apart.
60023237,Y Tu Mamá También,"When rich teens Tenoch and Julio meet the alluring, older Luisa, they try to impress her with stories of a road trip, then convince her to join them."
80093213,Spy Time,"When his girlfriend dumps him for being a bore, a working stiff discovers that his father is a secret agent and a dangerous thug is targeting them."
80103623,The Heroes of Evil,"Three teenage misfits find camaraderie in sex, violence and petty crime. But what starts as a lark soon threatens to damage them beyond repair."
80032640,The Perfect Dictatorship,"After accepting a colossal bribe, a powerful TV conglomerate gins up fake news stories to enhance the image of a notoriously corrupt politician."
81098589,Aziz Ansari: RIGHT NOW,"In a comedy special directed by Spike Jonze, Aziz Ansari shares deep personal insights and hilarious takes on wokeness, family and the social climate."
80221446,Mary Poppins Returns,"In 1930s London, Michael Banks and his three children get some help turning their topsy-turvy world around when his magical childhood nanny reappears."
80991107,Mr. Sunshine,A young boy who ends up in the U.S. after the 1871 Shinmiyangyo incident returns to Korea at a historical turning point and falls for a noblewoman.
80048977,The Invitation,"A man accepts an invitation to a dinner party hosted by his ex-wife, an unsettling affair that reopens old wounds and creates new tensions."
70189282,The Iron Lady,"Margaret Thatcher, the first female prime minister of Britain, navigates a career destined to change the rules of leadership and politics."
80119249,1 Mile to You,"After escaping the bus accident that killed his girlfriend, a high school student channels his grief into running, with the help of a new coach."
80117747,Take Me,"With his simulated kidnapping business flagging, an entrepreneur jumps at a weekend abduction opportunity – only to find the job isn't what it seems."
80004286,"Monster High: Scaris, City of Frights","When Clawdeen gets a chance to study with a top fashion designer, she and her pals hop on a plane to Scaris, France, the city where screams come true."
81039323,Sicilian Ghost Story,"When officials are slow to investigate a mysterious disappearance, a teen girl searches the dark woods on the outskirts of town for the boy she loves."
80192064,Luciano Mellera: Infantiloide,Argentina's Luciano Mellera emphasizes the humorous and fantastical aspects of childhood through comedic impersonations and insights on daily life.
80176715,The Legacy of a Whitetail Deer Hunter,A star of hunting videos strives to bond with his 12-year-old son on a wilderness trip but learns familial connections can't be forced.
80168029,The Skin of the Wolf,An animal trapper living in an abandoned mountain town in northern Spain seeks to resolve his loneliness by securing a wife.
80245121,White Fang,A loyal wolfdog's curiosity leads him on the adventure of a lifetime while serving a series of three distinctly different masters.
80177339,Motu Patlu: King of Kings,"Motu and Patlu want to help a circus lion get back to the jungle. On the way, the three become caught up in an exciting adventure in the forest."
80170277,Speech & Debate,"Fed up with the hypocrisy of the adults around them, three creative high school misfits revive an old debate club as a way to fight back."
80097355,Brahman Naman,This homage to 1980s teen sex comedies follows a college quiz bowl champion who knows almost everything – except how to talk to women.
70122316,Blue Valentine,"As Cindy and Dean muddle through their languishing marriage, they hearken back to the golden days when life was filled with possibility and romance."
80099089,Skiptrace,"To capture a crime lord who killed his partner and kidnapped his partner's daughter, a Hong Kong detective teams with a smart aleck American gambler."
70303706,Sommore: Chandelier Status,"Luminous funnywoman Sommore wows Miami with her unique take on body modification, Internet sex, the world of celebrities and more."
81039161,Ramen Shop,Ramen chef Masato travels to Singapore to retrace his mother's life and finds a deeper understanding of his family history and culture.
80240537,The Red Sea Diving Resort,Undercover agents open up a fake hotel to real tourists as a cover to help smuggle thousands of Ethiopian refugees to safety. Inspired by true events.
80997870,Flying Guillotine 2,"The emperor's reign of terror expands. Heroic outlaw Ma Teng joins a squad of female rebels, whose leader is torn between family loyalties."
60001377,The Five Venoms,A dying kung fu master sends his last student to track down five former pupils in order to learn which one of them has become evil.
81151899,7 (Seven),"Multiple women report their husbands as missing but when it appears they are looking for the same man, a police officer traces their cryptic connection."
81017011,American Hangman,"A judge’s kidnapping is streamed live on social media, as a vengeful loner puts him on trial for supposedly sending an innocent man to his death."
80999990,Holy Man 2,"Former rap musician Joey Boy is now a monk who takes Father Teng's place at his rural temple, where a crisis develops involving a nearby stone quarry."
80999991,Holy Man 3,"Two new monks, one of them a former rock music star seeking inner peace, join a temple plagued by thieves who are stealing its valuable holy relics."
81000000,The Unborn Child,"A couple and their young daughter are haunted by a paranormal, malicious presence – which is soon linked to a temple and a series of abortions."
80162192,Loco Love,A young man and woman fall in love but are threatened to be torn apart by the tensions between their Latino and Caucasian communities in Arizona.
70074100,All the Boys Love Mandy Lane,"During a weekend excursion to a secluded ranch, an unwelcome visitor begins picking off the randy admirers of teenage temptress Mandy Lane."
70224969,Felipe Esparza: They're Not Going to Laugh at You,"""Last Comic Standing"" winner Felipe Esparza runs riot in his first comedy special with his wry comments on life as a wild man from East Los Angeles."
70261273,Joan Rivers: Don't Start with Me,"At 78, Joan Rivers has no interest in slowing down, and no one's immune from her caustic barbs in this stand-up special."
70250364,Katt Williams: Kattpacalypse,"Urban comic Katt Williams ushers in Kattpacalypse, exploding with more energy than an atomic bomb and riffing on everything from Doomsday to Obama."
80198632,Mission of Honor,"As Hitler's Nazis threaten to take command of Britain's skies, a squadron of Polish pilots arrives to aid the Royal Air Force against a mutual enemy."
70278933,Her,Love comes to a lonely writer in the sleekest of packages when he finds himself falling for the advanced operating system he bought to run his life.
80093198,Tallulah,"While searching for her ex-boyfriend, a young drifter impulsively kidnaps a baby from a neglectful mother and pretends the child is her own."
81018141,Da Kath & Kim Code,"Kath and Kel's union is tested by Michael Bublé, daughter Kim tries pole dancing, pal Sharon finds love online, and a stalker lurks amid Yuletide cheer."
81015524,Kath & Kimderella,"Chipper baby boomer Kath, diva daughter Kim and hapless pal Sharon visit Papilloma, Italy, where a royal romance and knockoff fashions await."
70124965,The Company Men,A successful businessman comes face-to-face with America's downsizing epidemic when he loses his job and is forced to take a construction gig.
80999107,The Flying Guillotine,"In Qing-dynasty China, the emperor commands that a weapon be invented to kill at a distance without a trace. Then he orders it used on its wielders."
80992365,The Mansion,"A group of students celebrates New Year's at a remote Belgian estate, where their substance-fueled revelry soon descends into a bloodstained nightmare."
80195835,Diana: 7 Days That Shook the World,"This illuminating documentary examines the aftermath of Princess Diana’s tragic death and the tense, dramatic week leading up to her funeral."
80171022,The Incredible Jessica James,"Burned by a bad breakup, a struggling New York City playwright makes an unlikely connection with a divorced app designer she meets on a blind date."
80192135,Coco y Raulito: Carrusel de ternura,"A study in contrasts, comedy partners and good friends Coco Celis and Raúl Meneses alternate separate stand-up sets for double the laughs."
80236421,Extinction,"Plagued by dreams of an alien invasion, a family man faces his worst nightmare when an extraterrestrial force begins exterminating Earth's inhabitants."
81092331,1st Summoning,"Student filmmakers uncover occult rituals tied to an abandoned warehouse, then gradually realize the horror is closer than they think."
80173485,Boi,A young chauffeur who's at a crossroads in his life escorts a pair of clients around Barcelona and becomes embroiled in their mysterious quest.
81028404,Eerie,"When a student's suicide rattles an all-girls Catholic school, a clairvoyant guidance counselor leans on a ghost to uncover the convent's abusive past."
80198508,Girls With Balls,"Stranded in the woods and eyeballed by twisted hunters, members of a women’s volleyball team bump it up in the most dangerous game of their lives."
80228239,Guy Martin: Last Flight of the Vulcan Bomber,Guy Martin assists in preparing the last airworthy Vulcan bomber for a farewell tour while revealing the stories behind the iconic aircraft.
80155932,The Exception,"During World War II, a Nazi officer charged with protecting an exiled Kaiser Wilhelm II from spies begins a steamy affair with a secretive Dutch maid."
80994020,The Son,"In this psychological thriller, painter Lorenzo's life spirals out of control as he fears his wife is trying to isolate him from their infant son."
80049094,Amy,Rare home videos and interviews with Amy Winehouse's inner circle offer an intimate look at her journey from charismatic teen to troubled star.
80049177,Barely Lethal,A girl raised to be a government assassin just wants to be a normal teen – so she runs away and pretends to be a high school exchange student.
80025495,Dark Places,"Years after surviving a brutal crime as a child, Libby Day comes to believe that the brother she testified against for committing it may be innocent."
80023689,Ex Machina,"A coder at a tech company wins a week-long retreat at the compound of his company's CEO, where he's tasked with testing a new artificial intelligence."
70278930,Man of Tai Chi,"In this kung fu tale set in Beijing, a young man armed with incomparable martial arts skills gets embroiled in the world of underground fight clubs."
80038337,Mississippi Grind,A gambler mired in debt thinks another cardsharp may just be his good luck charm as the two head for New Orleans to buy into a high-stakes poker game.
80053475,Mojave,A lethal game of cat and mouse stretches from the desert to Tinseltown after Hollywood bad boy Thomas runs afoul of a cunning and dangerous drifter.
80999986,Pahuyut Fighting Beat,"When profit-seekers threaten to take over a bar in a tourist town, local martial artists put their skills to the test and fight back."
80022605,Remember,"Following the written instructions of his friend, senile Zev crosses the country to find and murder the Nazi who killed their families in Auschwitz."
80029901,Slow West,"Determined to find the woman he loves, a Scottish teenager braves the Western frontier of 19th-century America, with bounty hunters hot on his trail."
80037478,The End of the Tour,"""Rolling Stone"" reporter David Lipsky shadows famed writer David Foster Wallace in this fictionalized account of their revealing five-day encounter."
80007777,Bang Rajan 2,A small but fierce group of resistance fighters engages in a brutal battle to protect their village from an army of Burmese invaders.
80999987,My True Friend,A bullied student forms a bond with the leader of a youth gang and discovers the power and meaning of true friendship.
81000015,Oh My Ghost,"A group of friends encounters a folk spirit in their apartment, and their harebrained attempts to banish the ghost soon backfire."
80999982,Oh My Ghost 2,"The spirited trio are back to take on a new ghost-busting adventure at a mens' residence, where spooky secrets lurk around every corner."
81005453,Parmanu: The Story of Pokhran,"A dedicated government official puts his career in jeopardy by insisting that India become a nuclear power, a goal that powerful forces resist."
80999989,The Holy Man,"Formerly a troubled youth, a monk is given charge of a Buddhist temple neglected by superstitious villagers under the spell of a fake psychic."
70218312,Train of the Dead,Five teenagers on the lam hide out in an empty train. Little do they realize that the train is inhabited by ghosts on their way to final judgment.
80185321,Joe Mande’s Award-Winning Comedy Special,"Stand-up comic Joe Mande aims for critical adulation with this special that covers dating shows, ""Shark Tank,"" Jewish summer camp and much more."
70298116,Lizzie Borden Took an Ax,"This made-for-TV drama chronicles the scandal and enduring mystery surrounding Lizzie Borden, who was tried in 1892 for axing her parents to death."
80213658,Iliza Shlesinger: Elder Millennial,"Newly engaged comic Iliza Shlesinger dives into undeniable truths about life at age 35, the insanity of the road traveled and what's to come."
