show_id,title,description
80185876,Trolls Holiday Special,"When Queen Poppy realizes that Bridget and the Bergens don't have any holidays, she hatches a plan for Branch and the Snack Pack to help create one."
80117746,Blue Jay,"Two former high school sweethearts unexpectedly reunite in their old hometown, where they rediscover their magical bond and face a shared regret."
80142615,One in a Billion,Follow the journey of Satnam Singh Bhamara as he works to fulfill his dream of becoming the first India-born player to be drafted into the NBA.
80115673,Reggie Watts: Spatial,"The comic innovator delivers a surreal set blending experimental songs, jokes about grits, guns and drugs, and other improvised comedy adventures."
80105691,The Model,"Danish teen Emma moves to Paris hoping to become a top model, but her dreams soon unravel when her affair with photographer Shane turns obsessive."
80244190,Breath,"In mid-1970s Australia, two small-town teenage boys befriend an enigmatic middle-aged surfer, who urges them to see the thrill in facing their fears."
80187435,Craig Ferguson: Tickle Fight,"Cheeky comic Craig Ferguson keeps it casual as he discusses '70s porn, Japanese toilets and his mildly crime-filled days as a talk show host."
80104103,The Good Neighbor,"Two tech-savvy teens plot to fool a cranky old neighbor into believing his house is haunted, but their cruel prank soon takes some unexpected turns."
80004478,Bill Burr: I'm Sorry You Feel That Way,"Bill Burr escapes the zombie apocalypse, explores how rom-coms ruin great sex and explains how too many childhood hugs may be the downfall of man."
81188871,Let's Dance,"After his crew breaks up, a gifted but insecure hip-hop dancer teaches at a top ballet school in Paris, where he falls for an aspiring ballerina."
80211590,God's Not Dead: A Light in Darkness,"After a fire breaks out at his church, a pastor faces a legal battle against university leaders who wish to push the congregation off the campus."
80988989,The Cakemaker,"When a German baker travels to Jerusalem in search of his dead male lover’s family, his growing involvement with them may expose his truth."
80117080,Mercenary,"When he defies his cruel father and leaves New Caledonia to play rugby in France, young Soane learns hard lessons about life, love and success."
80042368,A Very Murray Christmas,"Bill Murray rounds up an all-star cast for an evening of music, mischief and barroom camaraderie in this irreverent twist on holiday variety shows."
70211474,Aarakshan,The decision by India's supreme court to establish caste-based reservations for jobs in education causes conflict between a teacher and his mentor.
81213876,Adrishya,A family’s harmonious existence is interrupted when the young son begins showing symptoms of anxiety that seem linked to disturbing events at home.
70056728,Ahista Ahista,"Stood up by her groom at the altar, a young woman finds help and healing from another man – until her ex-fiancé returns, hoping to win her back."
81161834,Albert Pinto Ko Gussa Kyun Aata Hai?,"As the police investigate his disappearance, a young man heads to Goa to carry out an act of vengeance fueled by years of pent-up anger toward society."
247747,Amar Akbar Anthony,"Abandoned in a park by their father, Amar, Akbar and Anthony grow up independently and have no knowledge of one another. They're reunited as adults when, by coincidence, they all give blood at the same hospital."
70064205,Anwar,"Seeking refuge in a Hindu temple after the tragic death of the girl he loved, a Muslim youth is caught by the police, who mistake him for an enemy."
80083672,Barah Aana,"After futile attempts to better their lives with honest work, three broke friends opt for a more dubious means of making money: kidnapping for ransom."
60003405,Bawarchi,A dysfunctional middle-class family is transformed by the attentions of their talented new chef – until he vanishes along with their valuable jewels.
70053010,Bazaar,"A young man challenges traditional customs by standing up to the father of the woman he loves, who has promised her to a wealthy expatriate."
70062701,Bhagam Bhag,"A theater group lands in trouble when its new actress takes her own life, two of its members are framed for murder and no one is who they appear to be."
81213889,Bhoot,"After a couple moves into an apartment, the wife’s increasingly disturbing behavior unravels chilling secrets about their new home’s past."
70005055,Bobby,"Raj, the son of strict, wealthy parents, falls in love with Bobby, the daughter of a poor Christian fisherman – a romance his parents oppose."
60029461,Carrie,This remake of the classic 1976 horror flick finds misfit Carrie getting revenge on all the cool people who've bullied her over the years.
81213893,Chal Mere Bhai,"When a secretary saves her tycoon boss's life, his family hears wedding bells. Problem is, she's already in love – with his younger brother."
372195,Child's Play,"When a rash of murders unfolds, 6-year-old Andy knows that his toy doll Chucky is the killer, but neither his mom nor the cops believe him."
20255593,Chupke Chupke,"Jealous of the high regard in which his new wife holds their brother-in-law, a botany professor stages an elaborate prank that will even the score."
70059328,Deadline: Sirf 24 Ghante,A surgeon’s perfect life is rattled when his daughter is taken hostage in their own home and he's given 24 hours to pay a hefty ransom.
81213888,Dhamaal,"Tipped off about buried money in Goa, four ne’er-do-well friends go on the hunt, chased by a police officer who wants the treasure for himself."
60024927,Die Another Day,Pierce Brosnan's final outing as 007 finds James Bond facing off against a North Korean terrorist who's in league with a British diamond merchant.
20255837,Don,A man who's a lookalike for a slain mob kingpin is asked by the police to impersonate the gangster and infiltrate his underworld organization.
70006866,Encounter: The Killing,"After accidentally killing a young mobster, a guilt-stricken police officer searches for the parents who never came forward to claim their son's body."
20077944,Ghayal,"Framed for his older brother's murder, a boxer seeks violent revenge against the true killer who's torn his family apart."
20705133,Ghulam-E-Musthafa,"Giving up his life of crime for love, a gangster struggles with a moral dilemma when tragic events and enduring enemies take him back to the underworld."
21028086,Gol Maal,"When circumstances at work compel Ram to pretend to have a twin, his lie works – until the boss wants his daughter to marry Ram’s fictitious brother."
22040803,GoldenEye,"Pierce Brosnan takes his first turn as debonair secret agent James Bond, who investigates the destruction of a Russian satellite weapons base."
70054380,Golmaal: Fun Unlimited,"Between thwarting crooks and wooing the belle next door, four pranksters get in over their heads when they bamboozle their way into a couple’s bungalow."
60020236,Heartbreakers,"In this stylish comedy, a mother-daughter con team makes money the old-fashioned way: They use their feminine wiles to swindle it."
20765027,Hera Pheri,The bond between two crooks and best friends is threatened when one learns that the other's father had a hand in his own tragic past.
81109078,How High 2,"When a pair of friends uncover a weed Bible, their magical stash gets stolen, sending them on a pot-fueled quest through Atlanta to find it."
81213885,Jaan-E-Mann: Let's Fall in Love... Again,"To avoid alimony payments, an aspiring actor schemes for his ex-wife to marry an unlikely suitor, but soon realizes he may not be ready to lose her."
70129075,Jail,"Incarcerated for a crime he didn’t commit, a young man must navigate the crowded, cut-throat environment of prison as he awaits trial."
70295531,John Day,"A bank manager and his wife, still grieving over their daughter who died in a fire, become pawns in a bank heist with ties to corruption and fraud."
17457622,Judwaa,"Separated at birth, a pair of identical twins unexpectedly reunite as adults and embark on a madcap mission to take down a common enemy from their past."
20712279,Kaalia,"Jailed for robbing his brother’s unscrupulous employer, a simpleton has a transformation while in prison, emerging with a violent mission for revenge."
70051840,Katha,"Secretly in love with his neighbor, a mild-mannered clerk is heartbroken when his much bolder, more charming friend wins her heart instead."
81213895,Khubsoorat,A strict matriarch's regimented household is upended by the arrival of a spunky relative who challenges the rules.
24073896,Koshish,A speech and hearing-impaired couple persists through unforgiving obstacles to be accepted by society and live a life of dignity.
81221913,Kuldip Patwal: I Didn't Do It!,"Accused of killing a politician, a local grocer’s fight to prove his innocence reveals his lifelong struggles with injustice leading up to the incident."
70040912,Maine Pyaar Kyun Kiya,"After lying to his girlfriend, orthopedic surgeon Samir must conjure up a pretend wife in this musical comedy."
81213979,Masoom,A loving husband and father's joyful family life is rocked to its core upon the discovery that he has a young son borne from a past extramarital affair.
70018445,Mujhse Shaadi Karogi,"Samir must overcome a hostile horoscope, a hot temper and a determined rival to win the heart of Rani, the love of his life."
81213897,Namak Halaal,"While loyally defending his boss from mobsters trying to kill him, a naive, hotel bellboy discovers the family he never knew he had."
81213882,Phullu,"Struck by the lack of clean resources for menstruating women in his village, a jobless loafer braves social stigmas to create low-cost sanitary napkins."
81213896,Rajnigandha,"A grad student leaves her boyfriend in Delhi for a job interview in Mumbai, where she reconnects with an old flame for whom she still has feelings."
60003097,Ram Teri Ganga Maili,"Abandoned by her new husband and father of her son, a mountain woman journeys to Calcutta to find him, constantly tested by social evils along the way."
81213887,Ramji Londonwaley,"A small-town cook moves to London to earn a living, but from his employer’s sudden death to the immigration officials on his trail, plans soon go sour."
896678,Red Dawn,A group of teenagers witnesses Soviet and Cuban paratroopers descending on their small Colorado town and systematically setting off World War III.
81217436,Road to Sangam,"As communal violence erupts in his neighborhood, a Muslim mechanic presses forward to repair a historic truck that will transport Gandhi’s last remains."
81221914,Saath Saath,"A young woman falls for her classmate’s idealistic, non-materialistic ways, but is troubled upon seeing his principles change after they marry."
70072558,Sadma,"After a traumatic injury leaves her with amnesia and age regression, a young woman is sold to a brothel before a teacher becomes her savior."
60002818,Sangam,"Returning home from war after being assumed dead, a pilot weds the woman he has long loved, unaware that she had been planning to marry his best friend."
20257617,Satte Pe Satta,"The eldest of seven brothers who run a family farm together marries a pretty nurse, inspiring his country-bumpkin siblings to follow his example."
70059284,Shiva,"A young man enrolls at a college and becomes a rival to the student-union president, who’s using force and intimidation to advance his criminal agenda."
60001404,Swami,"After she enters into an arranged marriage, a spirited and intellectual young woman tries to adjust to life with a man who was not her choice."
81213879,The Dark Side of Life: Mumbai City,"Struggling with Mumbai's pressures and private battles with depression, six lives intersect just as they reach a breaking point."
81213898,The Great Gambler,"After unwittingly using his skills to obtain military secrets, a gambler is pursued by a police officer who happens to be his doppelgänger."
28371873,The World Is Not Enough,"Greed, revenge, world domination: It's all in a day's work for James Bond, who's on a mission to protect an oil heiress from a notorious terrorist."
17016471,Tomorrow Never Dies,"Pierce Brosnan stars in this 007 installment, which teams the secret agent and a sexy Chinese superspy against a megalomaniacal media mogul."
70065255,Traffic Signal,"Four characters coexist at an urban traffic signal, where all manage to make a meager living until events threaten the source of their livelihood."
60021548,"Trikal (Past, Present, Future)","A Goan native returns to his now-derelict, palatial childhood home, recalling his family’s interpersonal drama during the end of Portuguese rule."
81217438,Union Leader,Toxic conditions and a corrupt union leader prompt a chemical plant worker and earnest family man to fight for justice for his fellow laborers.
81213873,Veerey Ki Wedding,"Quick to throw punches in the name of justice, a young man must find a calmer way to win over the pacifist father of the girl he wishes to marry."
81213874,Vodka Diaries,"While investigating a series of murders and the nightclub that links them, a detective’s case takes an alarming turn when his wife goes missing."
81213884,Zed Plus,A philandering small-town mechanic's political ambitions are sparked when the visiting prime minister mistakenly grants him special security clearance.
81045989,Bill Hicks: One Night Stand,"Bill Hicks remembers a wild night in 1989 and offers his views on puffing cigarettes, smoking weed, drinking, sex, commercials and music."
70059483,Bill Hicks: Relentless,"In one of his most iconic performances, late comedian Bill Hicks demonstrates what made him such a singular talent and a force to be reckoned with."
80108207,Bill Hicks: Revelations,"In his final recorded special, the iconoclastic comedian channels Goat Boy and tackles provocative topics like British porn, pot and the priesthood."
70043231,Bill Hicks: Sane Man,"Filmed in 1989 at a turning point in comedian Bill Hicks's career, this rare onstage performance captures him spouting off on a variety of topics."
60004393,Sam Kinison: Breaking the Rules,"The one-time preacher shakes and shudders as he tears into subjects including sex, marriage, religion, drugs and famine in this HBO special."
70026468,Sam Kinison: Family Entertainment Hour,"Comic Sam Kinison lets it rip with this performance at L.A.'s Wiltern theatre, skewering every segment of modern society from religion to television."
81031650,The Bill Murray Stories: Life Lessons Learned From a Mythical Man,"This documentary highlights spontaneous encounters with the elusive, comedic veteran, who touches lives by simply showing up anywhere."
81006261,The Seven Deadly Sins the Movie: Prisoners of the Sky,"The Seven Deadly Sins aid the Sky People against a powerful group of demons hellbent on resurrecting a demonic beast sealed over 3,000 years ago."
81045509,Tim Allen: Men Are Pigs,"Standup comedian Tim Allen delivers a set dedicated to ""men stuff"" like lawn care, power tools and why he grunts like an animal."
70298389,Tim Minchin And The Heritage Orchestra Live,"Flanked by a full orchestra, Tim Minchin takes the Royal Albert Hall by storm with a wonderfully witty evening of satirical musical comedy."
81045530,Tim Minchin: So F**king Rock,Comedic pianist Tim Minchin performs a host of his catchy songs that touch on everything from the Middle East to the healing power of canvas bags.
81045511,Todd Glass: Stand-Up Special,"Standup comedian Todd Glass gets right down to it, with sly observations on accepting directions, denying compliments and being afraid of the dark."
70266169,Tom Papa Live in New York City,"Comedian Tom Papa riffs on the trials of married life, fatherhood in the 21st century, domestic pets and more in his stand-up show."
80210716,Born Strong,Four 400-pound giants fight for the crown at the Arnold Strongman Classic and offer a glimpse into their lives leading up to the competition.
80230402,Dave Chappelle: Equanimity & The Bird Revelation,"Comedy titan Dave Chappelle caps a wild year with two stand-up specials packed with scorching new material, self-reflection and tough love."
80230465,Elles étaient en guerre (1914-1918),Trace the overlapping journeys of exceptional women swept up in World War I and hear their tales of bravery on history's front lines.
80168234,Fun Mom Dinner,"Four preschool moms with little in common need a night out to take a break from their kids. But one thing leads to another, and things get rowdy."
80221778,Geronimo Stilton,"With the help of brainy and adventurous sidekicks, New Mouse City's favorite journalist investigates mysteries that take him around the world,"
80184972,Ghost House,"While visiting the site of a supernatural shrine in the Thai countryside, a vacationing couple unwittingly upsets a vengeful demon."
80208212,Twice,"This documentary reenacts the experiences of late activist Tsutomu Yamaguchi, a survivor of both atomic bombings on Japan in 1945."
80218432,You Can Tutu,A gifted young ballet dancer struggles to find her footing in an uptight ballet school that brings her and her family to a brand-new neighborhood.
80115134,Dog Eat Dog,A delusional ex-con rejoins his unhinged former partners for one last job: kidnap the baby of a mobster's enemy for ransom.
80098284,Mr. Pig,An aging California pig farmer whose property is on the brink of foreclosure makes a last-ditch trip across the border to sell his prized hog.
80087891,Anesthesia,"After a popular professor is attacked on a New York street, the story of how a series of intertwined events led to the life-altering assault unfolds."
80022613,The Autopsy of Jane Doe,A father-son team of small-town coroners performs an autopsy on an unidentified woman with mysterious injuries and a terrifying secret.
80163263,Goon: Last of the Enforcers,"Injury and family push hockey player Doug Glatt into retirement, but his plans change when his beloved former team appoints his nemesis as captain."
81078397,The First Temptation of Christ,"Jesus, who's hitting the big 3-0, brings a surprise guest to meet the family. A Christmas special so wrong, it must be from comedians Porta dos Fundos."
80221271,Tiffany Haddish: Black Mitzvah,"On her 40th birthday, Tiffany Haddish drops a bombastic special studded with singing, dancing and raunchy reflections on her long road to womanhood."
80103374,War on Everyone,"Terry and Bob excel at blackmailing small-time crooks. But when the two cops target a big score, they learn not all criminals are easily intimidated."
81167490,Wish Man,"After surviving a life-threatening accident, a troubled cop finds new purpose when he bonds with a terminally ill little boy. Based on a true story."
81012943,Silencer,"When a drug lord kidnaps his girlfriend’s daughter, a retired assassin leaves his newly peaceful life to go on a ruthless rampage to rescue the child."
80044536,Diary of a Chambermaid,"An attractive young woman goes to work as a chambermaid for a troublesome couple. The wife is unreasonable, and the husband won't stop hitting on her."
70301620,Rezeta,"Gorgeous and free-spirited Albanian model Rezeta arrives in Mexico City, and soon uses her charms to take up a carefree new life in the metropolis."
70213471,Lawless,"This true-to-life action saga profiles Virginia's bootlegging Bondurant brothers, whose exploits during the Prohibition era made them outlaw heroes."
70132228,Shelter,A forensic psychiatrist has to think outside the box when she takes on a patient whose multiple personalities lead to a trail of murder victims.
80194671,The Climb,A young Senegalese-French man from humble roots sets out to climb Mount Everest to impress the woman he loves – and slowly becomes a media sensation.
70253398,Shrek the Musical,"The greatest fairy tale never told comes to life in this colorful, song-filled, Tony Award-winning Broadway production based on the hit movie."
80185375,A Twelve Year Night,Future Uruguayan president José Mujica and his fellow Tupamaro political prisoners fight to survive 12 years of solitary confinement and torture.
80097519,Avicii: True Stories,"Follow the meteoric rise of Tim Bergling, aka Avicii, from Swedish teenager to the creative force behind ""Wake Me Up,"" ""You Make Me"" and other hits."
81024730,Life Ki Toh Lag Gayi,"A vengeful son, a cop on a mission, a wannabe actress and a jilted lover find their lives intermingling in unexpected ways over 24 hours in Mumbai."
80151663,Oasis: Supersonic,This film details the rise of British rock group Oasis and the creativity and chaos that brothers Noel and Liam Gallagher brought to the iconic band.
80244708,When Angels Sleep,"After a businessman falls asleep at the wheel and hits a woman with his car, his interactions with her scared friend unleash a string of dark events."
80082739,Fifty,"In Lagos, Nigeria, four successful women on the verge of 50 take stock of their lives and loves over the course of one week."
81228864,Blitz Patrollie,"Caught between family pressures and small-time crime-fighting, a pair of bumbling cops tries to bust a massive drug deal and go down in history."
81094074,"El Pepe, a Supreme Life","In this intimate documentary, former Uruguayan President José ""Pepe"" Mujica talks about lessons he learned while in prison, his ideals and the future."
81044813,The Secret Life of Pets 2,"On a farm outside New York, Max aims to boost his confidence while in the city, Snowball attempts to rescue a tiger cub and Gidget pretends to be a cat."
81029400,At First Light,"After mysterious lights imbue her with extraordinary powers, a teenager goes on the run from authorities with the friend who harbors a crush on her."
80141781,Bibi & Tina: Tohuwabohu Total,Teen witch Bibi and her pal Tina return to the screen to reconcile a runaway girl with her narrow-minded family and save Falkenstein Castle from chaos.
70253590,Pusher,"In this remake of a 1996 Danish thriller, a drug pusher incurs his suppliers' wrath when he gets busted and is left without the money he owes."
81150338,The App,"While in Rome to shoot his first movie, actor and industrial heir Nick becomes obsessed with a dating app that sends him into a self-destructive spiral."
80013773,Left Behind,"After millions of people on Earth suddenly disappear, a pilot flying a plane stuck at 30,000 feet must find a way to ensure the passengers' survival."
80098103,The Innocents,"At the end of World War II, a French doctor with the Red Cross treats nuns at a Polish convent who were raped and impregnated by Russian soldiers."
80211991,You,"Obsessed with an aspiring writer, a charming bookstore manager goes to extreme measures to insert himself into her life."
80182473,Mr. Roosevelt,"A struggling comedian returns to Austin, Texas, to see her ailing cat and face her messy past – while staying with her ex and his new girlfriend."
80214478,Todd Barry: Spicy Honey,"With bone-dry wit, stand-up comic Todd Barry dissects texting emergencies, Hitler's taste in wine, pricey soap, cheap pizza and much more."
80182034,Walk with Me,A community of monks in France led by Zen Buddhist master Thich Nhat Hanh offers an intimate glimpse into mindfulness practice and the monastic life.
80083594,Marco Polo: One Hundred Eyes,A defiant warrior-monk arrives at Kublai Khan's court in chains and soon earns his tragic nickname in this 30-minute origin story.
81164603,Doom: Annihilation,"When a swarm of soul-stealing demons invades a Martian moon, a group of elite space Marines must obliterate the beasts to save Earth."
81000505,Fireworks,"Middle schooler Nazuna desperately wants to run away with her classmate Norimichi, who somehow turns back time on this fateful summer's day."
81045499,Grand-Daddy Day Care,A frustrated novelist with money problems opens an unsanctioned senior center at his house to make quick cash and occupy his cumbersome father-in-law.
81164636,Jarhead: Law of Return,"When a U.S. senator’s son is held captive by Hezbollah militiamen, a group of highly trained soldiers ventures into enemy territory to bring him home."
81037697,MFKZ,Mysterious goons chase teenage slacker Angelino through chaotic Dark Meat City as he uncovers secret powers that could be the key to saving the world.
80208235,Sweetheart,A woman shipwrecked on a remote island discovers she’s not alone and begins a fight for survival against a deadly presence that emerges each night.
80219127,Avengers: Infinity War,Superheroes amass to stop intergalactic sociopath Thanos from acquiring a full set of Infinity Stones and wiping out half of all life in the universe.
80052828,Backtrack,"Haunted by visions of the dead, psychologist Peter returns home to confront a long-ago trauma. But will the trip exorcise or embolden the ghosts?"
80244123,Como caído del cielo,"To earn his place in heaven, legendary Mexican actor-singer Pedro Infante is sent back to Earth in an impersonator's body to mend his womanizing ways."
81104634,John Mulaney & The Sack Lunch Bunch,"John Mulaney and his kid pals tackle existential topics for all ages with catchy songs, comedy sketches and special guests in a nostalgic variety special."
80171023,The Little Hours,Life at a convent takes an unruly turn when three unconventionally opinionated nuns cross paths with a tempting new gardener.
80107989,Watership Down,A warren of rabbits battles many threats on their daring journey to find a new home in this adaptation of the classic novel by Richard Adams.
80168161,Creep 2,"A video artist finds the perfect character for a sensational piece, but the subject of her dreams soon reveals his insidious side."
80158649,Myths & Monsters,This documentary series takes us to the mythic landscapes of Europe to explore some of most enduring legends produced by European culture.
